{
  "schema_version": "1.0.0",
  "generated_at": "2026-06-30T00:00:00Z",
  "provisional": false,
  "_comment": "No quality data published yet. Consumers return quality:null (e.g. /model) and run quality-gating inactive (e.g. /swap) until real per-model scores land from the Modelmeter eval pipeline (see modelmeter-ops/run-evals.mjs). Never ship fabricated scores here.",
  "sources": [],
  "models": []
}